{
  "$schema": "https://json-schema.org/draft/2020-12/schema",
  "title": "gt persona pack",
  "description": "Data only. gt_persona.py validate_pack is the authority; this file documents the same rules. A persona shapes what gt offers, never what it enforces: any key named lockdown, sandbox_mode, unlock, test_gate or protected_paths, at any depth, refuses the pack.",
  "type": "object",
  "additionalProperties": false,
  "required": ["schema", "name", "title", "scaffold"],
  "properties": {
    "schema": {"const": 1},
    "name": {"type": "string", "pattern": "^[a-z][a-z0-9-]{0,39}$", "description": "Must equal the file name without .json."},
    "title": {"type": "string", "maxLength": 80},
    "description": {"type": "string", "maxLength": 400},
    "audience": {"type": "string", "minLength": 1, "maxLength": 300, "pattern": "^[^\\n\\r]+$", "description": "Who this persona writes for and how, in one line (item #45). gt passes it, as an Audience block, to the agents that WRITE for the user (draft, briefs, summaries, wrap-ups) when persona_aligned is on; never to fact-finding agents. Presentation only."},
    "pane": {
      "type": "array",
      "minItems": 1,
      "maxItems": 12,
      "description": "The gt button pane's defaults for this persona (item #41): a label (22 characters at most) and the plain-words prompt the button sends. One line each.",
      "items": {
        "type": "object",
        "additionalProperties": false,
        "required": ["label", "prompt"],
        "properties": {
          "label": {"type": "string", "minLength": 1, "maxLength": 22},
          "prompt": {"type": "string", "minLength": 1, "maxLength": 500}
        }
      }
    },
    "scaffold": {
      "type": "object",
      "additionalProperties": false,
      "properties": {
        "files": {
          "type": "array",
          "items": {
            "type": "object",
            "additionalProperties": false,
            "required": ["path", "content"],
            "properties": {
              "path": {"type": "string", "description": "Relative .md path inside the project; never a standard project file, never '..'."},
              "content": {"type": "string", "description": "{TITLE} is replaced by the project title."}
            }
          }
        },
        "sections": {
          "type": "array",
          "items": {
            "type": "object",
            "additionalProperties": false,
            "required": ["file", "heading", "body"],
            "properties": {
              "file": {"enum": ["README.md", "idea.md", "source.md", "research.md", "decisions.md", "design.md", "runbook.md"]},
              "heading": {"type": "string"},
              "body": {"type": "string"}
            }
          }
        }
      }
    }
  }
}
