{
  "schema": 1,
  "name": "project-manager",
  "title": "Project manager",
  "description": "The same setup as product manager: a status board, a roadmap and a stakeholders list beside the standard project files.",
  "audience": "Plain language: lead with status, risks, blockers and the decisions needed; give owners and dates; no code unless asked.",
  "scaffold": {
    "files": [
      {
        "path": "status-board.md",
        "content": "# {TITLE} status board\n\n<!-- Where the work stands this week. Keep it current; move history to research.md. -->\n\n| Workstream | Owner | Status | Next step | Due |\n|---|---|---|---|---|\n\n## Risks and blockers\n\n"
      },
      {
        "path": "roadmap.md",
        "content": "# {TITLE} roadmap\n\n<!-- Milestones in order. One line each: date, outcome, owner. -->\n\n## Now\n\n## Next\n\n## Later\n\n"
      },
      {
        "path": "stakeholders.md",
        "content": "# {TITLE} stakeholders\n\n<!-- Who needs to know, who decides, who is waiting on whom. -->\n\n| Name | Role | Interest | Contact cadence |\n|---|---|---|---|\n\n"
      }
    ],
    "sections": []
  },
  "pane": [
    {"label": "Start my day", "prompt": "Start my day: show what is waiting for me, what is overdue and what I should do first."},
    {"label": "Overdue", "prompt": "Show my overdue tasks."},
    {"label": "What is waiting", "prompt": "What handoffs and tasks are waiting for me?"},
    {"label": "Add a task", "prompt": "I want to add a task. Ask me what it is and which project it belongs to."},
    {"label": "Status update", "prompt": "Write a short status update for the project we are in: what is done, what is next and what is at risk."},
    {"label": "Note a decision", "prompt": "Write down a decision. Ask me what was decided and why."},
    {"label": "Open a project", "prompt": "Open a project for me. Ask me which one."},
    {"label": "Sort my inbox", "prompt": "Review my inbox and file each item into the right project."},
    {"label": "Write a handoff", "prompt": "Write a handoff for the next session so nothing is lost."},
    {"label": "Clean up tasks", "prompt": "Work through my open tasks with me: close, drop, defer or keep each one."},
    {"label": "Find in my notes", "prompt": "Look something up in my notes. Ask me what I am looking for."},
    {"label": "Close a project", "prompt": "Close out a project. Ask me which one."}
  ]
}
