{
  "schema": 1,
  "name": "leadership",
  "title": "Leadership",
  "description": "A team list (who owns what), goals with their measures, and a decisions-needed list beside the standard project files.",
  "audience": "Plain language, outcome first: lead with status against goals, then risks, who owns what and the decisions needed; no code unless asked.",
  "scaffold": {
    "files": [
      {
        "path": "team.md",
        "content": "# {TITLE} team\n\n<!-- Who owns what, and who to go to for each area. Keep personal or HR notes out of the vault. -->\n\n| Person | Owns | Backup |\n|---|---|---|\n\n"
      },
      {
        "path": "goals.md",
        "content": "# {TITLE} goals\n\n<!-- This period's goals and how each will be measured. One line per goal: goal, measure, owner, status. -->\n\n| Goal | Measure | Owner | Status |\n|---|---|---|---|\n\n"
      },
      {
        "path": "decisions-needed.md",
        "content": "# {TITLE} decisions needed\n\n<!-- One line each: the decision, who decides, by when, what waits on it. -->\n\n"
      }
    ],
    "sections": []
  },
  "pane": [
    {"label": "Start my day", "prompt": "Start my day: show what is waiting for me, what is overdue and what I should do first."},
    {"label": "Team status", "prompt": "Summarise where each person or team stands on their work this week."},
    {"label": "Goals check", "prompt": "Check progress on our goals against their measures."},
    {"label": "Decisions needed", "prompt": "Show the decisions that are waiting on me."},
    {"label": "Overdue", "prompt": "Show my overdue tasks."},
    {"label": "What is waiting", "prompt": "What handoffs and tasks are waiting for me?"},
    {"label": "Add a task", "prompt": "I want to add a task. Ask me what it is and which project it belongs to."},
    {"label": "Note a decision", "prompt": "Write down a decision. Ask me what was decided and why."},
    {"label": "Open a project", "prompt": "Open a project for me. Ask me which one."},
    {"label": "Sort my inbox", "prompt": "Review my inbox and file each item into the right project."},
    {"label": "Find in my notes", "prompt": "Look something up in my notes. Ask me what I am looking for."},
    {"label": "Write a handoff", "prompt": "Write a handoff for the next session so nothing is lost."}
  ]
}
